{
  "parties": {
    "mom": "Jane",
    "dad": "John",
    "children": ["Roger", "Jamie"]
  },
  "calendar_week_system": "ISO8601",
  "handoff": {
    "weekdays": "school",
    "special_handoffs": {
      "sunday": {
        "from_guardian": "dad",
        "to_guardian": "mom",
        "time": {
          "hour": 13,
          "minute": 0,
          "use_24h": false,
          "by": true
        },
        "description": "dad_to_mom_by_1pm"
      }
    }
  },
  "rules": {
    "weekdays": {
      "monday": "mom",
      "tuesday": "dad",
      "wednesday": "mom",
      "thursday": "dad"
    },
    "weekends": {
      "odd_weeks": {
        "friday": "mom",
        "saturday": "mom",
        "sunday": "mom"
      },
      "even_weeks": {
        "friday": "dad",
        "saturday": "dad",
        "sunday": {
          "modulo_rules": [
            {
              "modulo": 4,
              "remainder": 0,
              "guardian": "dad"
            }
          ],
          "otherwise": "mom"
        }
      }
    }
  },
  "holidays": {},
  "swaps": {
    "2025-12-25": {
      "guardian": "mom",
      "note": "Christmas",
      "handoff": "at mom's house by 10am"
    },
    "2025-07-04": {
      "guardian": "dad",
      "color": "red",
      "note": "4th of July"
    }
  },
  "visualization": {
    "mom": "hot_pink",
    "dad": "midnight_blue",
    "holiday": "light_blue",
    "unknown": "gray",
    "swap_shade_percent": 20,
    "start_weekday": "monday"
  }
}
